[
  {
    "id": "source-switch-confirm-valid",
    "event": "source.switch.confirm",
    "valid": true,
    "payload": {
      "from": {
        "sourceId": "source-old",
        "bookId": "book-old"
      },
      "target": {
        "sourceId": "source-new",
        "bookId": "book-new",
        "title": "New source",
        "author": "Author",
        "coverUrl": null
      },
      "newToc": [
        {
          "chapterId": "c1",
          "chapterTitle": "Chapter 1",
          "chapterUrl": "https://example.test/c1",
          "order": 0
        }
      ],
      "currentChapterTitle": "Chapter 1",
      "currentChapterIndex": 0,
      "updatedAt": 300
    }
  },
  {
    "id": "source-switch-confirm-missing",
    "event": "source.switch.confirm",
    "valid": false,
    "payload": {
      "from": {
        "sourceId": "source-old",
        "bookId": "book-old"
      },
      "target": {
        "sourceId": "source-new",
        "bookId": "book-new",
        "title": "New source"
      },
      "newToc": [
        {
          "chapterId": "c1",
          "chapterTitle": "Chapter 1",
          "chapterUrl": "u",
          "order": 0
        }
      ],
      "currentChapterTitle": "Chapter 1",
      "currentChapterIndex": 0
    }
  },
  {
    "id": "source-switch-confirm-unknown-nested",
    "event": "source.switch.confirm",
    "valid": false,
    "payload": {
      "from": {
        "sourceId": "source-old",
        "bookId": "book-old",
        "origin": "invented"
      },
      "target": {
        "sourceId": "source-new",
        "bookId": "book-new",
        "title": "New source"
      },
      "newToc": [
        {
          "chapterId": "c1",
          "chapterTitle": "Chapter 1",
          "chapterUrl": "u",
          "order": 0
        }
      ],
      "currentChapterTitle": "Chapter 1",
      "currentChapterIndex": 0,
      "updatedAt": 300
    }
  },
  {
    "id": "source-switch-confirm-wrong-nested-type",
    "event": "source.switch.confirm",
    "valid": false,
    "payload": {
      "from": {
        "sourceId": "source-old",
        "bookId": "book-old"
      },
      "target": {
        "sourceId": "source-new",
        "bookId": "book-new",
        "title": "New source"
      },
      "newToc": [
        {
          "chapterId": "c1",
          "chapterTitle": "Chapter 1",
          "chapterUrl": "u",
          "order": "0"
        }
      ],
      "currentChapterTitle": "Chapter 1",
      "currentChapterIndex": 0,
      "updatedAt": 300
    }
  },
  {
    "id": "source-switch-rollback-valid",
    "event": "source.switch.rollback",
    "valid": true,
    "payload": {
      "rollbackToken": {
        "oldBook": {
          "sourceId": "source-old",
          "bookId": "book-old",
          "addedAt": 10,
          "title": "Old"
        },
        "oldProgress": null,
        "oldProgressHistory": [],
        "committedBook": {
          "sourceId": "source-new",
          "bookId": "book-new",
          "addedAt": 10,
          "title": "New"
        },
        "committedProgressHistory": [],
        "replacedTargetBook": null
      }
    }
  },
  {
    "id": "source-switch-rollback-missing",
    "event": "source.switch.rollback",
    "valid": false,
    "payload": {}
  },
  {
    "id": "source-switch-rollback-unknown-nested",
    "event": "source.switch.rollback",
    "valid": false,
    "payload": {
      "rollbackToken": {
        "oldBook": {
          "sourceId": "source-old",
          "bookId": "book-old",
          "addedAt": 10,
          "legacyOrigin": "x"
        },
        "committedBook": {
          "sourceId": "source-new",
          "bookId": "book-new",
          "addedAt": 10
        }
      }
    }
  },
  {
    "id": "source-switch-rollback-wrong-nested-type",
    "event": "source.switch.rollback",
    "valid": false,
    "payload": {
      "rollbackToken": {
        "oldBook": {
          "sourceId": "source-old",
          "bookId": "book-old",
          "addedAt": "10"
        },
        "committedBook": {
          "sourceId": "source-new",
          "bookId": "book-new",
          "addedAt": 10
        }
      }
    }
  },
  {
    "id": "replace-apply-valid",
    "event": "reader.replace.apply",
    "valid": true,
    "payload": {
      "text": "rain",
      "bookName": "Book",
      "bookOrigin": "source",
      "target": "chapter"
    }
  },
  {
    "id": "replace-apply-missing",
    "event": "reader.replace.apply",
    "valid": false,
    "payload": {
      "text": "rain",
      "bookName": "Book",
      "target": "chapter"
    }
  },
  {
    "id": "replace-apply-unknown",
    "event": "reader.replace.apply",
    "valid": false,
    "payload": {
      "text": "rain",
      "bookName": "Book",
      "bookOrigin": "source",
      "target": "chapter",
      "scope": "invented"
    }
  },
  {
    "id": "replace-apply-wrong-type",
    "event": "reader.replace.apply",
    "valid": false,
    "payload": {
      "text": "rain",
      "bookName": "Book",
      "bookOrigin": "source",
      "target": [
        "chapter"
      ]
    }
  },
  {
    "id": "replace-create-valid",
    "event": "reader.replace.create",
    "valid": true,
    "payload": {
      "operation": "create",
      "params": {
        "id": 41,
        "name": "rename",
        "pattern": "rain",
        "replacement": "sun",
        "scopeContent": true,
        "isRegex": false
      }
    }
  },
  {
    "id": "replace-create-missing",
    "event": "reader.replace.create",
    "valid": false,
    "payload": {
      "params": {
        "pattern": "rain"
      }
    }
  },
  {
    "id": "replace-create-unknown-nested",
    "event": "reader.replace.create",
    "valid": false,
    "payload": {
      "operation": "create",
      "params": {
        "pattern": "rain",
        "replace": "invented"
      }
    }
  },
  {
    "id": "replace-create-wrong-nested-type",
    "event": "reader.replace.create",
    "valid": false,
    "payload": {
      "operation": "create",
      "params": {
        "id": "41"
      }
    }
  },
  {
    "id": "replace-validate-valid",
    "event": "reader.replace.validate",
    "valid": true,
    "payload": {
      "pattern": "rain",
      "isRegex": true,
      "scope": [
        "chapter",
        "title"
      ]
    }
  },
  {
    "id": "replace-validate-missing",
    "event": "reader.replace.validate",
    "valid": false,
    "payload": {
      "pattern": "rain"
    }
  },
  {
    "id": "replace-validate-unknown",
    "event": "reader.replace.validate",
    "valid": false,
    "payload": {
      "pattern": "rain",
      "scope": [
        "chapter"
      ],
      "flags": "i"
    }
  },
  {
    "id": "replace-validate-wrong-nested-type",
    "event": "reader.replace.validate",
    "valid": false,
    "payload": {
      "pattern": "rain",
      "scope": [
        "chapter",
        2
      ]
    }
  },
  {
    "id": "rss-refresh-valid",
    "event": "rss.refresh",
    "valid": true,
    "payload": {
      "subscriptionId": "feed-a",
      "evaluatedAt": 300
    }
  },
  {
    "id": "rss-refresh-missing",
    "event": "rss.refresh",
    "valid": false,
    "payload": {
      "evaluatedAt": 300
    }
  },
  {
    "id": "rss-refresh-unknown",
    "event": "rss.refresh",
    "valid": false,
    "payload": {
      "subscriptionId": "feed-a",
      "force": true
    }
  },
  {
    "id": "rss-refresh-wrong-type",
    "event": "rss.refresh",
    "valid": false,
    "payload": {
      "subscriptionId": "feed-a",
      "evaluatedAt": "300"
    }
  },
  {
    "id": "rss-add-valid",
    "event": "rss.subscription.add",
    "valid": true,
    "payload": {
      "operation": "create",
      "params": {
        "subscriptionId": "feed-a",
        "feedUrl": "https://feed.test/rss.xml",
        "title": "Feed",
        "siteUrl": null,
        "enabled": true
      }
    }
  },
  {
    "id": "rss-add-missing",
    "event": "rss.subscription.add",
    "valid": false,
    "payload": {
      "operation": "create",
      "params": {
        "subscriptionId": "feed-a"
      }
    }
  },
  {
    "id": "rss-add-unknown-nested",
    "event": "rss.subscription.add",
    "valid": false,
    "payload": {
      "operation": "create",
      "params": {
        "subscriptionId": "feed-a",
        "feedUrl": "https://feed.test/rss.xml",
        "url": "invented"
      }
    }
  },
  {
    "id": "rss-add-wrong-nested-type",
    "event": "rss.subscription.add",
    "valid": false,
    "payload": {
      "operation": "create",
      "params": {
        "subscriptionId": "feed-a",
        "feedUrl": "https://feed.test/rss.xml",
        "enabled": "true"
      }
    }
  },
  {
    "id": "rss-edit-valid",
    "event": "rss.subscription.edit",
    "valid": true,
    "payload": {
      "operation": "update",
      "params": {
        "subscriptionId": "feed-a",
        "feedUrl": "https://feed.test/new.xml",
        "title": "Renamed",
        "enabled": false
      }
    }
  },
  {
    "id": "rss-edit-missing",
    "event": "rss.subscription.edit",
    "valid": false,
    "payload": {
      "operation": "update",
      "params": {
        "title": "Renamed"
      }
    }
  },
  {
    "id": "rss-edit-unknown-nested",
    "event": "rss.subscription.edit",
    "valid": false,
    "payload": {
      "operation": "update",
      "params": {
        "subscriptionId": "feed-a",
        "siteUrl": "invented"
      }
    }
  },
  {
    "id": "rss-edit-wrong-nested-type",
    "event": "rss.subscription.edit",
    "valid": false,
    "payload": {
      "operation": "update",
      "params": {
        "subscriptionId": "feed-a",
        "enabled": 1
      }
    }
  },
  {
    "id": "rss-delete-valid",
    "event": "rss.subscription.delete",
    "valid": true,
    "payload": {
      "subscriptionId": "feed-a"
    }
  },
  {
    "id": "rss-delete-missing",
    "event": "rss.subscription.delete",
    "valid": false,
    "payload": {}
  },
  {
    "id": "rss-delete-unknown",
    "event": "rss.subscription.delete",